{
  "schema_version": 1,
  "list_name": "ShieldSign Official List",
  "domains": [
    "accounts.google.com",
    "login.microsoftonline.com",
    "account.apple.com",
    "login.live.com",
    "www.dropbox.com",
    "auth.services.adobe.com",
    "id.atlassian.com",
    "login.salesforce.com",
    "idp.okta.com",
    "login.okta.com",
    "eu-north-1.signin.aws.amazon.com",
    "signin.aws.amazon.com",
    "signon.pingidentity.com",
    "login.ibm.com",
    "portal.azure.com",
    "auth0.auth0.com",
    "github.com",
    "www.paypal.com",
    "dashboard.stripe.com",
    "signin.ebay.com",
    "www.amazon.com",
    "us.etrade.com",
    "www.americanexpress.com",
    "connexion-mabanque.bnpparibas",
    "www.facebook.com",
    "accounts.google.com", 
    "www.linkedin.com",
    "x.com",
    "twitter.com",
    "accounts.snapchat.com",
    "discord.com",
    "login.skype.com",
    "www.netflix.com",
    "accounts.spotify.com",
    "auth.hbomax.com",
    "www.disneyplus.com",
    "www.twitch.tv",
    "www.epicgames.com",
    "store.steampowered.com",
    "connect.ubisoft.com",
    "login.orange.fr",
    "subscribe.free.f",
    "laposte.net",
    "www.sfr.fr",
    "www.ovh.com",
    "manager.infomaniak.com",
    "account.proton.me",
    "app.qonto.com",
    "account.scaleway.com",
    "login.slack.com",
    "www.notion.so",
    "www.figma.com",
    "accounts.miro.com",
    "airtable.com",
    "outlook.live.com",
    "mail.yahoo.com"
  ],
  "maintainer": "singequantique@proton.me"
}
